{
  "$schema": "../../../schemas/registered-family.schema.json",
  "schemaVersion": 2,
  "projectSlug": "vox-depth-stack-pilot-submarine",
  "sceneId": "submarine-scene",
  "groupId": "submarine-depth-stack",
  "familyId": "submarine-depth-family",
  "pattern": "registered-depth-stack",
  "motionCapability": "bounded-relative",
  "sourcePackageId": "submarine-seaweed-layer-package",
  "sourceStrategy": "registered-layer-sheet",
  "revealEnvelope": {
    "16:9": {
      "x": 0.04,
      "y": 0.02,
      "scale": 0.09,
      "rotationDegrees": 1
    },
    "9:16": {
      "x": 0.025,
      "y": 0.03,
      "scale": 0.08,
      "rotationDegrees": 1
    },
    "1:1": {
      "x": 0.03,
      "y": 0.025,
      "scale": 0.08,
      "rotationDegrees": 1
    }
  },
  "registration": {
    "id": "submarine-depth-registration",
    "sourceMasterAssetId": "submarine-reference",
    "canvas": {
      "width": 1024,
      "height": 1024
    },
    "origin": "top-left"
  },
  "members": [
    {
      "assetId": "ocean-rear",
      "nodeId": "ocean-rear",
      "role": "support-rear",
      "slot": "support-rear",
      "completeness": "clean-plate",
      "output": "public/projects/vox-depth-stack-pilot-submarine/assets/environment/ocean-rear.png",
      "source": {
        "kind": "registered-layer-sheet",
        "assetId": "submarine-layer-sheet",
        "packageRole": "support-rear"
      },
      "derivation": {
        "sourceRect": {
          "left": 629,
          "top": 2,
          "width": 623,
          "height": 623
        },
        "placement": {
          "left": 0,
          "top": 0,
          "width": 1024,
          "height": 1024
        }
      }
    },
    {
      "assetId": "yellow-submarine",
      "nodeId": "yellow-submarine",
      "role": "subject",
      "slot": "subject",
      "completeness": "full-silhouette",
      "output": "public/projects/vox-depth-stack-pilot-submarine/assets/environment/yellow-submarine.png",
      "source": {
        "kind": "registered-layer-sheet",
        "assetId": "submarine-layer-sheet",
        "packageRole": "subject"
      },
      "derivation": {
        "sourceRect": {
          "left": 2,
          "top": 629,
          "width": 623,
          "height": 623
        },
        "placement": {
          "left": 0,
          "top": 0,
          "width": 1024,
          "height": 1024
        },
        "keying": {
          "keyColor": "#fa01cd",
          "transparentThreshold": 95,
          "opaqueThreshold": 180,
          "edgeFeather": 0.6,
          "matteErode": 1,
          "edgePadding": 8
        }
      }
    },
    {
      "assetId": "seaweed-front",
      "nodeId": "seaweed-front",
      "role": "support-front",
      "slot": "support-front",
      "completeness": "full-overlay",
      "output": "public/projects/vox-depth-stack-pilot-submarine/assets/environment/seaweed-front.png",
      "source": {
        "kind": "registered-layer-sheet",
        "assetId": "submarine-layer-sheet",
        "packageRole": "support-front"
      },
      "derivation": {
        "sourceRect": {
          "left": 629,
          "top": 629,
          "width": 623,
          "height": 623
        },
        "placement": {
          "left": 0,
          "top": 0,
          "width": 1024,
          "height": 1024
        },
        "keying": {
          "keyColor": "#fa02cd",
          "transparentThreshold": 95,
          "opaqueThreshold": 180,
          "edgeFeather": 0.6,
          "matteErode": 1,
          "edgePadding": 8
        }
      }
    }
  ],
  "recoveryPolicy": {
    "strategy": "preserve-family-context",
    "localDeterministicFixFirst": true,
    "isolatedMemberGeneration": "forbidden",
    "providerRepair": "masked-complete-source-edit",
    "fallback": "full-source-regeneration"
  },
  "applyToProject": true
}
